{
  "reportDate": "2026-10-09",
  "revenueCNY": 112000,
  "orderCount": 6,
  "units": 91,
  "previousRevenueCNY": 60000,
  "wowPercent": 86.67,
  "topRegion": {
    "name": "华东",
    "revenueCNY": 47000
  },
  "topProduct": {
    "name": "订阅B",
    "revenueCNY": 63000
  },
  "summary": "本期（2026-10-05 至 2026-10-09）已完成销售 112,000 元，共 6 单、91 件，较上周同期增长 86.67%。华东以 47,000 元领先，订阅B贡献 63,000 元。统计基于读取时快照，不包含待完成订单；现有数据不足以解释增长原因。",
  "risks": [
    {
      "text": "本期待完成订单 1 单未计入业绩。"
    },
    {
      "text": "日期列无时间戳，金额反映读取快照，不是严格的 17:00 逐笔截止。"
    }
  ],
  "nextActions": [
    {
      "text": "核对待完成订单状态，确认后纳入下一次报告。"
    },
    {
      "text": "补充业务原因与目标数据，再判断区域及产品表现。"
    }
  ],
  "emailSubject": "2026-10-09 销售周报（草稿）",
  "emailBody": "本期（2026-10-05 至 2026-10-09）已完成销售 112,000 元，共 6 单、91 件，较上周同期增长 86.67%。华东以 47,000 元领先，订阅B贡献 63,000 元。统计基于读取时快照，不包含待完成订单；现有数据不足以解释增长原因。\n\n风险：待完成订单未计入；日期列没有时间戳。\n\n下周建议：核对订单状态，补充目标与原因数据。请审阅 Word 附件后再发送。",
  "pptOutline": [
    {
      "title": "本周销售概览",
      "body": "112000 元，6 单，较上周同期增长 86.67%。"
    },
    {
      "title": "区域与产品分布",
      "body": "华东 47000 元；订阅B 63000 元。"
    },
    {
      "title": "风险与下一步",
      "body": "核对待完成订单，补充目标和业务原因；所有建议需人工确认。"
    }
  ]
}
