{
  "reportDate": "2026-10-09",
  "revenueCNY": 112000,
  "orderCount": 6,
  "units": 91,
  "previousRevenueCNY": 60000,
  "wowPercent": 86.67,
  "topRegion": {
    "name": "华东",
    "revenueCNY": 47000
  },
  "topProduct": {
    "name": "订阅B",
    "revenueCNY": 63000
  },
  "summary": "截至2026年10月9日（UTC+8），本期销售收入为112,000元，订单数6单，销售单位91件，较上期60,000元增长86.67%。华东地区贡献最高收入47,000元，领先区域明显。订阅B产品表现最佳，收入63,000元。数据统计截止至2026年10月9日09:00 UTC快照，口径为本周起始日至截止日已完成订单。",
  "risks": [
    {
      "text": "数据统计截止时间为2026年10月9日09:00 UTC，未包含当日09:00后录入订单。"
    },
    {
      "text": "存在1笔待处理订单未计入本期数据，可能影响最终统计结果。"
    }
  ],
  "nextActions": [
    {
      "text": "持续监控订单录入时间，确保数据完整性。"
    },
    {
      "text": "加强华东地区及订阅B产品的市场推广，巩固领先优势。"
    },
    {
      "text": "优化订单处理流程，减少待处理订单数量。"
    }
  ],
  "emailSubject": "2026-10-09销售周报",
  "emailBody": "关键指标：截至2026年10月9日（UTC+8），本期销售收入为112,000元，订单数6单，销售单位91件，较上期增长86.67%。华东地区和订阅B产品表现突出，分别贡献47,000元和63,000元。\n风险提示：数据截止于2026年10月9日09:00 UTC，未包含当日09:00后录入订单，且存在1笔待处理订单未计入，可能影响数据完整性。\n下周建议：建议持续监控订单录入时间，确保数据完整；加强华东地区及订阅B产品推广；优化订单处理流程，减少待处理订单。",
  "pptOutline": [
    {
      "title": "业绩概览",
      "body": "本期销售收入112,000元，订单6单，销售单位91件，环比增长86.67%。"
    },
    {
      "title": "销售分布",
      "body": "华东地区收入最高，达47,000元；华南和华北分别为38,000元和27,000元。订阅B为最畅销产品，收入63,000元。"
    },
    {
      "title": "后续行动",
      "body": "监控订单录入时间，确保数据完整；加强重点区域和产品推广；优化订单处理流程。"
    }
  ]
}
